{
  "id" : 101010 ,
  "name" : "Workflow Scheme One" ,
  "description" : "Workflow Scheme One Description" ,
  "defaultWorkflow" : "DefaultWorkflowName" ,
  "issueTypeMappings" : {
    "IsueTypeId2" : "WorkflowName" ,
    "IsueTypeId" : "WorkflowName"
  } ,
  "draft" : false ,
  "self" : "http://www.example.com/jira/rest/api/2/workflowscheme/101010"
}